{
  "id": "urn:ngsi-ld:Ride:2026-10-11-tamagawa",
  "type": "Ride",
  "name": "Morning ride along the Tama River",
  "rideType": "road",
  "startTime": "2026-10-11T06:42:10+09:00",
  "endTime": "2026-10-11T09:05:48+09:00",
  "distance": 48230,
  "movingDuration": "PT1H58M",
  "elevationGain": 212,
  "location": {
    "type": "LineString",
    "coordinates": [
      [
        139.6497,
        35.5838
      ],
      [
        139.6188,
        35.6024
      ],
      [
        139.5872,
        35.6178
      ],
      [
        139.5565,
        35.6312
      ],
      [
        139.5249,
        35.6446
      ],
      [
        139.4986,
        35.6558
      ]
    ]
  },
  "trackUrl": "https://example.org/tracks/2026-10-11-tamagawa.gpx"
}
